{
  "version": 1,
  "provenance": {
    "verified_on": "2026-08-10T01:27:49Z",
    "method": "Resolved each upstream HTTPS remote HEAD with git ls-remote and recorded the exact returned commit; a second independent re-verification on the same day returned the same refs, so both stay pinned. No ref was ever filled without verification.",
    "command": "git ls-remote https://github.com/mylinuxforwork/dotfiles.git HEAD; git ls-remote https://github.com/Gentleman-Programming/Gentleman.Dots.git HEAD"
  },
  "upstreams": {
    "ml4w": {
      "name": "ML4W (Hyprland desktop dotfiles)",
      "url": "https://github.com/mylinuxforwork/dotfiles.git",
      "status": "pinned",
      "pinned_ref": "46f2ca7f73fe98b16ce4ab6433a9ac29fa9fd033",
      "verified_on": "2026-08-10T01:27:49Z"
    },
    "gentleman-dots": {
      "name": "Gentleman.Dots (shell / editor / terminal base configuration)",
      "url": "https://github.com/Gentleman-Programming/Gentleman.Dots.git",
      "status": "pinned",
      "pinned_ref": "02584500de6378ff5f54d252dc28fce8424b088a",
      "verified_on": "2026-08-10T01:27:49Z"
    }
  },
  "owned_paths": {}
}
